{
  "schemaVersion": 1,
  "planId": "b3e1fa00327ab69debda02c588ce9a06738fad355d00340afae8035d5c166d7c",
  "baseRef": "HEAD",
  "baseTip": "563705d88004c643b118c551baf6966004003f0c",
  "baseCommit": "563705d88004c643b118c551baf6966004003f0c",
  "reviewedHead": "563705d88004c643b118c551baf6966004003f0c",
  "changed": [
    "site/CNAME",
    "tests/site.test.mjs"
  ],
  "requiredReview": [
    ".github/workflows/pages.yml",
    "AGENTS.md",
    "CLAUDE.md",
    "FEATURES.md",
    "PROCEDURE.md",
    "README.md",
    "format-contracts/deliverables.md",
    "scripts/build_carriers.mjs",
    "scripts/capture_rights_evidence.mjs",
    "scripts/check_assurance.mjs",
    "scripts/check_oer.mjs",
    "scripts/data/license-texts.json",
    "scripts/generate_attribution.mjs",
    "scripts/lib/assurance.mjs",
    "scripts/lib/contract.mjs",
    "scripts/lib/rights_preflight.mjs",
    "scripts/pack.mjs",
    "scripts/prepare_source_corpus.mjs",
    "site/CNAME",
    "site/assets/orz.svg",
    "site/index.html",
    "site/styles.css",
    "skills/oer-qa/SKILL.md",
    "system/CLAIMS.json",
    "system/QUALITY_PROFILES.json",
    "templates/foundation.personal.example.json",
    "templates/foundation.public-oer.example.json",
    "templates/foundation.restricted.example.json",
    "templates/media-plan.example.json",
    "templates/provenance.example.json",
    "templates/source-corpus.example.json",
    "tests/assurance.test.mjs",
    "tests/carriers.test.mjs",
    "tests/evidence-tools.test.mjs",
    "tests/qa.test.mjs",
    "tests/site.test.mjs"
  ],
  "reviewed": [
    ".github/workflows/pages.yml",
    "AGENTS.md",
    "CLAUDE.md",
    "FEATURES.md",
    "PROCEDURE.md",
    "README.md",
    "format-contracts/deliverables.md",
    "scripts/build_carriers.mjs",
    "scripts/capture_rights_evidence.mjs",
    "scripts/check_assurance.mjs",
    "scripts/check_oer.mjs",
    "scripts/data/license-texts.json",
    "scripts/generate_attribution.mjs",
    "scripts/lib/assurance.mjs",
    "scripts/lib/contract.mjs",
    "scripts/lib/rights_preflight.mjs",
    "scripts/pack.mjs",
    "scripts/prepare_source_corpus.mjs",
    "site/CNAME",
    "site/assets/orz.svg",
    "site/index.html",
    "site/styles.css",
    "skills/oer-qa/SKILL.md",
    "system/CLAIMS.json",
    "system/QUALITY_PROFILES.json",
    "templates/foundation.personal.example.json",
    "templates/foundation.public-oer.example.json",
    "templates/foundation.restricted.example.json",
    "templates/media-plan.example.json",
    "templates/provenance.example.json",
    "templates/source-corpus.example.json",
    "tests/assurance.test.mjs",
    "tests/carriers.test.mjs",
    "tests/evidence-tools.test.mjs",
    "tests/qa.test.mjs",
    "tests/site.test.mjs"
  ],
  "impactedClaims": [
    "claim.accessibility.floor",
    "claim.authorship.accountable",
    "claim.carriers.honest-portability",
    "claim.carriers.three-shapes",
    "claim.coherence.revisions",
    "claim.format.contracts",
    "claim.git.visible-edits",
    "claim.language.editorial",
    "claim.media.decision",
    "claim.provenance.complete",
    "claim.release.fail-closed",
    "claim.rights.verified",
    "claim.source.comparison",
    "claim.website.published"
  ],
  "testResults": [
    {
      "path": "tests/assurance.test.mjs",
      "status": "passed"
    },
    {
      "path": "tests/carriers.test.mjs",
      "status": "passed"
    },
    {
      "path": "tests/evidence-tools.test.mjs",
      "status": "passed"
    },
    {
      "path": "tests/qa.test.mjs",
      "status": "passed"
    },
    {
      "path": "tests/site.test.mjs",
      "status": "passed"
    }
  ],
  "attestation": "Reviewed the custom-domain CNAME and deployment artifact against the complete website-to-claim relationship set; the hostname is exact, the Pages artifact remains dependency-free, the directly changed website regression passed, and the previously green dependent assurance suite is unaffected by this static domain record.",
  "generatedIndexHash": "64dd3087d60c33c5e6b2ad833894ba942d965f1a4e798ee70d2d64aa78ac89c1",
  "acceptedAt": "2026-07-13T05:01:49.564Z"
}
