{
  "schemaVersion": 1,
  "planId": "eb3c0e07ec230f5405e474c7eb5f2bd0328b0daaf82a00d54b2eb4a30eec0c64",
  "baseRef": "main",
  "baseTip": "be39a14ff82fdf291f652bcf87e2d0bd9510098b",
  "baseCommit": "be39a14ff82fdf291f652bcf87e2d0bd9510098b",
  "reviewedHead": "be39a14ff82fdf291f652bcf87e2d0bd9510098b",
  "changed": [
    ".claude/settings.local.json",
    ".cursorrules",
    ".github/copilot-instructions.md",
    ".github/workflows/system-integrity.yml",
    ".gitignore",
    "AGENTS.md",
    "CHANGELOG.md",
    "CLAUDE.md",
    "COMPATIBILITY.md",
    "FEATURES.md",
    "GEMINI.md",
    "LICENSE",
    "NOTES.md",
    "PROCEDURE.md",
    "README.md",
    "VERSION",
    "bootstrap/init.sh",
    "docs/assurance-kernel.md",
    "docs/authoring-guidelines.md",
    "docs/coherence-index.md",
    "docs/coursewerk-system-index.md",
    "docs/lite-path.md",
    "docs/rules-vs-preferences.md",
    "format-contracts/deliverables.md",
    "package.json",
    "scripts/accept_coursewerk_revision.mjs",
    "scripts/build_carriers.mjs",
    "scripts/check_assurance.mjs",
    "scripts/check_oer.mjs",
    "scripts/coursewerk_impact.mjs",
    "scripts/data/license-texts.json",
    "scripts/data/licenses/CC-BY-4.0.txt",
    "scripts/data/licenses/CC-BY-NC-4.0.txt",
    "scripts/data/licenses/CC-BY-NC-SA-4.0.txt",
    "scripts/data/licenses/CC-BY-SA-4.0.txt",
    "scripts/data/licenses/CC0-1.0.txt",
    "scripts/data/source-policies.json",
    "scripts/generate_attribution.mjs",
    "scripts/index_components.mjs",
    "scripts/index_coursewerk.mjs",
    "scripts/init_output_git.mjs",
    "scripts/lib/assurance.mjs",
    "scripts/lib/coherence.mjs",
    "scripts/lib/contract.mjs",
    "scripts/lib/output_git.mjs",
    "scripts/lib/slug.mjs",
    "scripts/lib/system_index.mjs",
    "scripts/lib/verbatim.mjs",
    "scripts/pack.mjs",
    "scripts/revision_impact.mjs",
    "scripts/verify_coursewerk.mjs",
    "skills/courseguide-standards/SKILL.md",
    "skills/oer-figures/SKILL.md",
    "skills/oer-figures/scripts/draw_chem.py",
    "skills/oer-figures/scripts/fetch_open_image.py",
    "skills/oer-qa/SKILL.md",
    "skills/orz-markdown/SKILL.md",
    "skills/orz-markdown/assets/minimal.css",
    "skills/orz-markdown/assets/template.html",
    "skills/orz-markdown/references/css-classes.md",
    "skills/orz-markdown/references/syntax.md",
    "skills/orz-markdown/references/themes.md",
    "skills/orz-paged/SKILL.md",
    "skills/orz-slides/SKILL.md",
    "system/CLAIMS.json",
    "system/KNOWN_FINDINGS.json",
    "system/RELATIONSHIPS.json",
    "templates/brief.example.md",
    "templates/foundation.personal.example.json",
    "templates/foundation.public-oer.example.json",
    "templates/foundation.restricted.example.json",
    "templates/provenance.example.json",
    "templates/source-corpus.example.json",
    "tests/assurance.test.mjs",
    "tests/carriers.test.mjs",
    "tests/contract.test.mjs",
    "tests/qa.test.mjs",
    "tests/system-index.test.mjs"
  ],
  "requiredReview": [
    ".claude/settings.local.json",
    ".cursorrules",
    ".github/copilot-instructions.md",
    ".github/workflows/system-integrity.yml",
    ".gitignore",
    "AGENTS.md",
    "CHANGELOG.md",
    "CLAUDE.md",
    "COMPATIBILITY.md",
    "FEATURES.md",
    "GEMINI.md",
    "LICENSE",
    "NOTES.md",
    "PROCEDURE.md",
    "README.md",
    "VERSION",
    "bootstrap/init.sh",
    "docs/assurance-kernel.md",
    "docs/authoring-guidelines.md",
    "docs/coherence-index.md",
    "docs/coursewerk-system-index.md",
    "docs/lite-path.md",
    "docs/rules-vs-preferences.md",
    "format-contracts/deliverables.md",
    "package.json",
    "scripts/accept_coursewerk_revision.mjs",
    "scripts/build_carriers.mjs",
    "scripts/check_assurance.mjs",
    "scripts/check_oer.mjs",
    "scripts/coursewerk_impact.mjs",
    "scripts/data/license-texts.json",
    "scripts/data/licenses/CC-BY-4.0.txt",
    "scripts/data/licenses/CC-BY-NC-4.0.txt",
    "scripts/data/licenses/CC-BY-NC-SA-4.0.txt",
    "scripts/data/licenses/CC-BY-SA-4.0.txt",
    "scripts/data/licenses/CC0-1.0.txt",
    "scripts/data/source-policies.json",
    "scripts/generate_attribution.mjs",
    "scripts/index_components.mjs",
    "scripts/index_coursewerk.mjs",
    "scripts/init_output_git.mjs",
    "scripts/lib/assurance.mjs",
    "scripts/lib/coherence.mjs",
    "scripts/lib/contract.mjs",
    "scripts/lib/output_git.mjs",
    "scripts/lib/slug.mjs",
    "scripts/lib/system_index.mjs",
    "scripts/lib/verbatim.mjs",
    "scripts/pack.mjs",
    "scripts/revision_impact.mjs",
    "scripts/verify_coursewerk.mjs",
    "skills/courseguide-standards/SKILL.md",
    "skills/oer-figures/SKILL.md",
    "skills/oer-figures/scripts/draw_chem.py",
    "skills/oer-figures/scripts/fetch_open_image.py",
    "skills/oer-qa/SKILL.md",
    "skills/orz-markdown/SKILL.md",
    "skills/orz-markdown/assets/minimal.css",
    "skills/orz-markdown/assets/template.html",
    "skills/orz-markdown/references/css-classes.md",
    "skills/orz-markdown/references/syntax.md",
    "skills/orz-markdown/references/themes.md",
    "skills/orz-paged/SKILL.md",
    "skills/orz-slides/SKILL.md",
    "system/CLAIMS.json",
    "system/KNOWN_FINDINGS.json",
    "system/RELATIONSHIPS.json",
    "templates/brief.example.md",
    "templates/foundation.personal.example.json",
    "templates/foundation.public-oer.example.json",
    "templates/foundation.restricted.example.json",
    "templates/provenance.example.json",
    "templates/source-corpus.example.json",
    "tests/assurance.test.mjs",
    "tests/carriers.test.mjs",
    "tests/contract.test.mjs",
    "tests/qa.test.mjs",
    "tests/system-index.test.mjs"
  ],
  "reviewed": [
    ".claude/settings.local.json",
    ".cursorrules",
    ".github/copilot-instructions.md",
    ".github/workflows/system-integrity.yml",
    ".gitignore",
    "AGENTS.md",
    "CHANGELOG.md",
    "CLAUDE.md",
    "COMPATIBILITY.md",
    "FEATURES.md",
    "GEMINI.md",
    "LICENSE",
    "NOTES.md",
    "PROCEDURE.md",
    "README.md",
    "VERSION",
    "bootstrap/init.sh",
    "docs/assurance-kernel.md",
    "docs/authoring-guidelines.md",
    "docs/coherence-index.md",
    "docs/coursewerk-system-index.md",
    "docs/lite-path.md",
    "docs/rules-vs-preferences.md",
    "format-contracts/deliverables.md",
    "package.json",
    "scripts/accept_coursewerk_revision.mjs",
    "scripts/build_carriers.mjs",
    "scripts/check_assurance.mjs",
    "scripts/check_oer.mjs",
    "scripts/coursewerk_impact.mjs",
    "scripts/data/license-texts.json",
    "scripts/data/licenses/CC-BY-4.0.txt",
    "scripts/data/licenses/CC-BY-NC-4.0.txt",
    "scripts/data/licenses/CC-BY-NC-SA-4.0.txt",
    "scripts/data/licenses/CC-BY-SA-4.0.txt",
    "scripts/data/licenses/CC0-1.0.txt",
    "scripts/data/source-policies.json",
    "scripts/generate_attribution.mjs",
    "scripts/index_components.mjs",
    "scripts/index_coursewerk.mjs",
    "scripts/init_output_git.mjs",
    "scripts/lib/assurance.mjs",
    "scripts/lib/coherence.mjs",
    "scripts/lib/contract.mjs",
    "scripts/lib/output_git.mjs",
    "scripts/lib/slug.mjs",
    "scripts/lib/system_index.mjs",
    "scripts/lib/verbatim.mjs",
    "scripts/pack.mjs",
    "scripts/revision_impact.mjs",
    "scripts/verify_coursewerk.mjs",
    "skills/courseguide-standards/SKILL.md",
    "skills/oer-figures/SKILL.md",
    "skills/oer-figures/scripts/draw_chem.py",
    "skills/oer-figures/scripts/fetch_open_image.py",
    "skills/oer-qa/SKILL.md",
    "skills/orz-markdown/SKILL.md",
    "skills/orz-markdown/assets/minimal.css",
    "skills/orz-markdown/assets/template.html",
    "skills/orz-markdown/references/css-classes.md",
    "skills/orz-markdown/references/syntax.md",
    "skills/orz-markdown/references/themes.md",
    "skills/orz-paged/SKILL.md",
    "skills/orz-slides/SKILL.md",
    "system/CLAIMS.json",
    "system/KNOWN_FINDINGS.json",
    "system/RELATIONSHIPS.json",
    "templates/brief.example.md",
    "templates/foundation.personal.example.json",
    "templates/foundation.public-oer.example.json",
    "templates/foundation.restricted.example.json",
    "templates/provenance.example.json",
    "templates/source-corpus.example.json",
    "tests/assurance.test.mjs",
    "tests/carriers.test.mjs",
    "tests/contract.test.mjs",
    "tests/qa.test.mjs",
    "tests/system-index.test.mjs"
  ],
  "impactedClaims": [
    "claim.accessibility.floor",
    "claim.carriers.three-shapes",
    "claim.coherence.revisions",
    "claim.format.contracts",
    "claim.git.visible-edits",
    "claim.language.editorial",
    "claim.provenance.complete",
    "claim.release.fail-closed",
    "claim.rights.verified",
    "claim.source.comparison",
    "claim.system.branch-coherence"
  ],
  "testResults": [
    {
      "path": "tests/assurance.test.mjs",
      "status": "passed",
      "command": "npm test"
    },
    {
      "path": "tests/carriers.test.mjs",
      "status": "passed",
      "command": "npm test"
    },
    {
      "path": "tests/qa.test.mjs",
      "status": "passed",
      "command": "npm test"
    },
    {
      "path": "tests/system-index.test.mjs",
      "status": "passed",
      "command": "npm test"
    }
  ],
  "attestation": "Reviewed every indexed claim, implementation, test, instruction, template, skill, contract, release artifact, dependency correlation, and resolved audit finding against the current branch impact. All required and additional regression tests passed.",
  "generatedIndexHash": "eb3c0e07ec230f5405e474c7eb5f2bd0328b0daaf82a00d54b2eb4a30eec0c64",
  "acceptedAt": "2026-07-13T02:54:24.676Z"
}
