{
  "schemaVersion": 1,
  "planId": "c3a5e494ff0438486469dc0c606d8a9a8839d996752250b10dc4c708d7e65552",
  "baseRef": "main",
  "baseTip": "4238dad8b48acf4a3d062e93ce872e26519a28a6",
  "baseCommit": "4238dad8b48acf4a3d062e93ce872e26519a28a6",
  "reviewedHead": "4238dad8b48acf4a3d062e93ce872e26519a28a6",
  "changed": [
    "AGENTS.md",
    "CHANGELOG.md",
    "CLAUDE.md",
    "FEATURES.md",
    "PROCEDURE.md",
    "README.md",
    "VERSION",
    "docs/assurance-kernel.md",
    "docs/authoring-guidelines.md",
    "docs/coherence-index.md",
    "docs/lite-path.md",
    "docs/wikipedia-science-topic.md",
    "format-contracts/deliverables.md",
    "package.json",
    "scripts/attest_visual_review.mjs",
    "scripts/bind_key_fact_review.mjs",
    "scripts/build_carriers.mjs",
    "scripts/capture_media_evidence.mjs",
    "scripts/capture_rights_evidence.mjs",
    "scripts/check_assurance.mjs",
    "scripts/check_oer.mjs",
    "scripts/generate_source_record.mjs",
    "scripts/lib/assurance.mjs",
    "scripts/lib/coherence.mjs",
    "scripts/lib/key_fact_review.mjs",
    "scripts/lib/source_record.mjs",
    "scripts/lib/visual_review.mjs",
    "scripts/pack.mjs",
    "scripts/prepare_source_corpus.mjs",
    "scripts/prepare_wikipedia_topic.mjs",
    "site/assets/showcase-plate-tectonics-course.png",
    "site/assets/showcase-plate-tectonics-slides.png",
    "site/assets/showcase-plate-tectonics-study-guide.png",
    "site/index.html",
    "site/styles.css",
    "skills/oer-qa/SKILL.md",
    "system/CLAIMS.json",
    "system/KNOWN_FINDINGS.json",
    "system/QUALITY_PROFILES.json",
    "system/RELATIONSHIPS.json",
    "templates/foundation.public-oer.example.json",
    "templates/foundation.wikipedia-science.example.json",
    "templates/key-fact-review.example.json",
    "templates/provenance.example.json",
    "templates/source-corpus.example.json",
    "templates/source-record.example.json",
    "templates/visual-review.example.json",
    "tests/assurance.test.mjs",
    "tests/carriers.test.mjs",
    "tests/evidence-tools.test.mjs",
    "tests/qa.test.mjs",
    "tests/reviews.test.mjs",
    "tests/site.test.mjs"
  ],
  "requiredReview": [
    ".github/workflows/pages.yml",
    "AGENTS.md",
    "CHANGELOG.md",
    "CLAUDE.md",
    "FEATURES.md",
    "PROCEDURE.md",
    "README.md",
    "VERSION",
    "docs/assurance-kernel.md",
    "docs/authoring-guidelines.md",
    "docs/coherence-index.md",
    "docs/lite-path.md",
    "docs/wikipedia-science-topic.md",
    "format-contracts/deliverables.md",
    "package.json",
    "scripts/attest_visual_review.mjs",
    "scripts/bind_key_fact_review.mjs",
    "scripts/build_carriers.mjs",
    "scripts/capture_media_evidence.mjs",
    "scripts/capture_rights_evidence.mjs",
    "scripts/check_assurance.mjs",
    "scripts/check_oer.mjs",
    "scripts/data/license-texts.json",
    "scripts/generate_attribution.mjs",
    "scripts/generate_source_record.mjs",
    "scripts/index_components.mjs",
    "scripts/lib/assurance.mjs",
    "scripts/lib/coherence.mjs",
    "scripts/lib/contract.mjs",
    "scripts/lib/key_fact_review.mjs",
    "scripts/lib/rights_preflight.mjs",
    "scripts/lib/source_record.mjs",
    "scripts/lib/visual_review.mjs",
    "scripts/pack.mjs",
    "scripts/prepare_source_corpus.mjs",
    "scripts/prepare_wikipedia_topic.mjs",
    "scripts/revision_impact.mjs",
    "site/assets/orz.svg",
    "site/assets/showcase-plate-tectonics-course.png",
    "site/assets/showcase-plate-tectonics-slides.png",
    "site/assets/showcase-plate-tectonics-study-guide.png",
    "site/index.html",
    "site/styles.css",
    "skills/oer-qa/SKILL.md",
    "system/CLAIMS.json",
    "system/KNOWN_FINDINGS.json",
    "system/QUALITY_PROFILES.json",
    "system/RELATIONSHIPS.json",
    "templates/foundation.personal.example.json",
    "templates/foundation.public-oer.example.json",
    "templates/foundation.restricted.example.json",
    "templates/foundation.wikipedia-science.example.json",
    "templates/key-fact-review.example.json",
    "templates/media-plan.example.json",
    "templates/provenance.example.json",
    "templates/source-corpus.example.json",
    "templates/source-record.example.json",
    "templates/visual-review.example.json",
    "tests/assurance.test.mjs",
    "tests/carriers.test.mjs",
    "tests/evidence-tools.test.mjs",
    "tests/qa.test.mjs",
    "tests/reviews.test.mjs",
    "tests/site.test.mjs"
  ],
  "reviewed": [
    ".github/workflows/pages.yml",
    "AGENTS.md",
    "CHANGELOG.md",
    "CLAUDE.md",
    "FEATURES.md",
    "PROCEDURE.md",
    "README.md",
    "VERSION",
    "docs/assurance-kernel.md",
    "docs/authoring-guidelines.md",
    "docs/coherence-index.md",
    "docs/lite-path.md",
    "docs/wikipedia-science-topic.md",
    "format-contracts/deliverables.md",
    "package.json",
    "scripts/attest_visual_review.mjs",
    "scripts/bind_key_fact_review.mjs",
    "scripts/build_carriers.mjs",
    "scripts/capture_media_evidence.mjs",
    "scripts/capture_rights_evidence.mjs",
    "scripts/check_assurance.mjs",
    "scripts/check_oer.mjs",
    "scripts/data/license-texts.json",
    "scripts/generate_attribution.mjs",
    "scripts/generate_source_record.mjs",
    "scripts/index_components.mjs",
    "scripts/lib/assurance.mjs",
    "scripts/lib/coherence.mjs",
    "scripts/lib/contract.mjs",
    "scripts/lib/key_fact_review.mjs",
    "scripts/lib/rights_preflight.mjs",
    "scripts/lib/source_record.mjs",
    "scripts/lib/visual_review.mjs",
    "scripts/pack.mjs",
    "scripts/prepare_source_corpus.mjs",
    "scripts/prepare_wikipedia_topic.mjs",
    "scripts/revision_impact.mjs",
    "site/assets/orz.svg",
    "site/assets/showcase-plate-tectonics-course.png",
    "site/assets/showcase-plate-tectonics-slides.png",
    "site/assets/showcase-plate-tectonics-study-guide.png",
    "site/index.html",
    "site/styles.css",
    "skills/oer-qa/SKILL.md",
    "system/CLAIMS.json",
    "system/KNOWN_FINDINGS.json",
    "system/QUALITY_PROFILES.json",
    "system/RELATIONSHIPS.json",
    "templates/foundation.personal.example.json",
    "templates/foundation.public-oer.example.json",
    "templates/foundation.restricted.example.json",
    "templates/foundation.wikipedia-science.example.json",
    "templates/key-fact-review.example.json",
    "templates/media-plan.example.json",
    "templates/provenance.example.json",
    "templates/source-corpus.example.json",
    "templates/source-record.example.json",
    "templates/visual-review.example.json",
    "tests/assurance.test.mjs",
    "tests/carriers.test.mjs",
    "tests/evidence-tools.test.mjs",
    "tests/qa.test.mjs",
    "tests/reviews.test.mjs",
    "tests/site.test.mjs"
  ],
  "impactedClaims": [
    "claim.accessibility.floor",
    "claim.authorship.accountable",
    "claim.carriers.honest-portability",
    "claim.carriers.three-shapes",
    "claim.coherence.revisions",
    "claim.format.contracts",
    "claim.git.visible-edits",
    "claim.language.editorial",
    "claim.media.decision",
    "claim.provenance.complete",
    "claim.release.fail-closed",
    "claim.review.key-facts",
    "claim.rights.verified",
    "claim.source.comparison",
    "claim.website.published",
    "claim.website.showcase"
  ],
  "testResults": [
    {
      "path": "tests/assurance.test.mjs",
      "status": "passed"
    },
    {
      "path": "tests/carriers.test.mjs",
      "status": "passed"
    },
    {
      "path": "tests/evidence-tools.test.mjs",
      "status": "passed"
    },
    {
      "path": "tests/qa.test.mjs",
      "status": "passed"
    },
    {
      "path": "tests/reviews.test.mjs",
      "status": "passed"
    },
    {
      "path": "tests/site.test.mjs",
      "status": "passed"
    }
  ],
  "attestation": "Reviewed the complete merge-base impact set across the existing release-assurance work and the new public showcase. Verified that the live-course disclosure is consistent in site/index.html, README.md, FEATURES.md, and system/CLAIMS.json; that the three local screenshots are authentic captures of the published course, study guide, and image-led content slide; that alt text, navigation, external-link policy, responsive desktop/mobile layouts, and GitHub Pages deployment remain accessible and dependency-free; and that the new screenshot relationships propagate through Coursewerk's system graph. Unchanged correlated contracts, assurance code, templates, skills, deployment, and product claims remain compatible. The complete 71-test repository suite passed, and the showcase was visually inspected at 1440×1000 and 390×844.",
  "generatedIndexHash": "8df228b161d7ed40d3f46ba8cde9d795f9bf058e0405a83c5bda7db44fe8b00d",
  "acceptedAt": "2026-07-14T12:36:26.078Z"
}
