{
  "schemaVersion": 1,
  "planId": "f8eb9e96d9d3a4d4c47aee2919cc0a3434580eba8cdc52ed8cb43f7675d51f63",
  "baseRef": "HEAD",
  "baseTip": "55663d0a3b50f3d7f44c76307cef170083dc0ff0",
  "baseCommit": "55663d0a3b50f3d7f44c76307cef170083dc0ff0",
  "reviewedHead": "55663d0a3b50f3d7f44c76307cef170083dc0ff0",
  "changed": [
    "CHANGELOG.md",
    "CLAUDE.md",
    "FEATURES.md",
    "PROCEDURE.md",
    "README.md",
    "VERSION",
    "docs/assurance-kernel.md",
    "docs/authoring-guidelines.md",
    "docs/lite-path.md",
    "docs/wikipedia-science-topic.md",
    "format-contracts/deliverables.md",
    "package.json",
    "scripts/capture_rights_evidence.mjs",
    "scripts/check_assurance.mjs",
    "scripts/check_oer.mjs",
    "scripts/data/source-policies.json",
    "scripts/lib/assurance.mjs",
    "scripts/lib/pre_ingestion.mjs",
    "scripts/lib/rights_preflight.mjs",
    "scripts/pack.mjs",
    "scripts/prepare_source_corpus.mjs",
    "scripts/prepare_wikipedia_topic.mjs",
    "site/index.html",
    "skills/courseguide-standards/SKILL.md",
    "skills/oer-figures/SKILL.md",
    "skills/oer-qa/SKILL.md",
    "system/CLAIMS.json",
    "system/KNOWN_FINDINGS.json",
    "templates/brief.example.md",
    "templates/foundation.personal.example.json",
    "templates/foundation.public-oer.example.json",
    "templates/foundation.restricted.example.json",
    "templates/foundation.wikipedia-science.example.json",
    "templates/source-corpus.example.json",
    "tests/assurance.test.mjs",
    "tests/evidence-tools.test.mjs",
    "tests/qa.test.mjs"
  ],
  "requiredReview": [
    ".github/workflows/pages.yml",
    "AGENTS.md",
    "CHANGELOG.md",
    "CLAUDE.md",
    "FEATURES.md",
    "PROCEDURE.md",
    "README.md",
    "VERSION",
    "docs/assurance-kernel.md",
    "docs/authoring-guidelines.md",
    "docs/lite-path.md",
    "docs/wikipedia-science-topic.md",
    "format-contracts/deliverables.md",
    "package.json",
    "scripts/build_carriers.mjs",
    "scripts/capture_rights_evidence.mjs",
    "scripts/check_assurance.mjs",
    "scripts/check_oer.mjs",
    "scripts/data/license-texts.json",
    "scripts/data/source-policies.json",
    "scripts/generate_attribution.mjs",
    "scripts/lib/assurance.mjs",
    "scripts/lib/contract.mjs",
    "scripts/lib/pre_ingestion.mjs",
    "scripts/lib/rights_preflight.mjs",
    "scripts/pack.mjs",
    "scripts/prepare_source_corpus.mjs",
    "scripts/prepare_wikipedia_topic.mjs",
    "site/assets/orz.svg",
    "site/index.html",
    "site/styles.css",
    "skills/courseguide-standards/SKILL.md",
    "skills/oer-figures/SKILL.md",
    "skills/oer-qa/SKILL.md",
    "system/CLAIMS.json",
    "system/KNOWN_FINDINGS.json",
    "system/QUALITY_PROFILES.json",
    "templates/brief.example.md",
    "templates/foundation.personal.example.json",
    "templates/foundation.public-oer.example.json",
    "templates/foundation.restricted.example.json",
    "templates/foundation.wikipedia-science.example.json",
    "templates/media-plan.example.json",
    "templates/provenance.example.json",
    "templates/source-corpus.example.json",
    "tests/assurance.test.mjs",
    "tests/carriers.test.mjs",
    "tests/evidence-tools.test.mjs",
    "tests/qa.test.mjs",
    "tests/site.test.mjs"
  ],
  "reviewed": [
    ".github/workflows/pages.yml",
    "AGENTS.md",
    "CHANGELOG.md",
    "CLAUDE.md",
    "FEATURES.md",
    "PROCEDURE.md",
    "README.md",
    "VERSION",
    "docs/assurance-kernel.md",
    "docs/authoring-guidelines.md",
    "docs/lite-path.md",
    "docs/wikipedia-science-topic.md",
    "format-contracts/deliverables.md",
    "package.json",
    "scripts/build_carriers.mjs",
    "scripts/capture_rights_evidence.mjs",
    "scripts/check_assurance.mjs",
    "scripts/check_oer.mjs",
    "scripts/data/license-texts.json",
    "scripts/data/source-policies.json",
    "scripts/generate_attribution.mjs",
    "scripts/lib/assurance.mjs",
    "scripts/lib/contract.mjs",
    "scripts/lib/pre_ingestion.mjs",
    "scripts/lib/rights_preflight.mjs",
    "scripts/pack.mjs",
    "scripts/prepare_source_corpus.mjs",
    "scripts/prepare_wikipedia_topic.mjs",
    "site/assets/orz.svg",
    "site/index.html",
    "site/styles.css",
    "skills/courseguide-standards/SKILL.md",
    "skills/oer-figures/SKILL.md",
    "skills/oer-qa/SKILL.md",
    "system/CLAIMS.json",
    "system/KNOWN_FINDINGS.json",
    "system/QUALITY_PROFILES.json",
    "templates/brief.example.md",
    "templates/foundation.personal.example.json",
    "templates/foundation.public-oer.example.json",
    "templates/foundation.restricted.example.json",
    "templates/foundation.wikipedia-science.example.json",
    "templates/media-plan.example.json",
    "templates/provenance.example.json",
    "templates/source-corpus.example.json",
    "tests/assurance.test.mjs",
    "tests/carriers.test.mjs",
    "tests/evidence-tools.test.mjs",
    "tests/qa.test.mjs",
    "tests/site.test.mjs"
  ],
  "impactedClaims": [
    "claim.accessibility.floor",
    "claim.authorship.accountable",
    "claim.carriers.honest-portability",
    "claim.carriers.three-shapes",
    "claim.coherence.revisions",
    "claim.format.contracts",
    "claim.git.visible-edits",
    "claim.language.editorial",
    "claim.media.decision",
    "claim.provenance.complete",
    "claim.release.fail-closed",
    "claim.rights.verified",
    "claim.source.comparison",
    "claim.website.published"
  ],
  "testResults": [
    {
      "path": "tests/assurance.test.mjs",
      "status": "passed"
    },
    {
      "path": "tests/carriers.test.mjs",
      "status": "passed"
    },
    {
      "path": "tests/evidence-tools.test.mjs",
      "status": "passed"
    },
    {
      "path": "tests/qa.test.mjs",
      "status": "passed"
    },
    {
      "path": "tests/site.test.mjs",
      "status": "passed"
    }
  ],
  "attestation": "Reviewed the complete dependency impact for fail-closed pre-ingestion clearance, structured source evidence, phase-specific assurance reporting, revision-pinned Wikipedia corpus preparation, attribution requirements, packaging receipts, documentation, templates, skills, website claims, and regression coverage. The complete 58-test suite passed, syntax and whitespace checks passed, and a live official-Wikimedia smoke test cleared two sources before serial retrieval into a 9,480-word, revision-recorded corpus.",
  "generatedIndexHash": "2b4473254813324e492e97eedef6b0dbf7cdc64c2216f94103905bc0a935b346",
  "acceptedAt": "2026-07-13T06:24:44.821Z"
}
