{
  "schemaVersion": 1,
  "planId": "9a0a8d369c10722db74ee52586becdbaa0c2f43e9f440a1e3234105c88922e1d",
  "baseRef": "HEAD",
  "baseTip": "2a874739a7f9985c042e2494bbf28ff06d21f382",
  "baseCommit": "2a874739a7f9985c042e2494bbf28ff06d21f382",
  "reviewedHead": "2a874739a7f9985c042e2494bbf28ff06d21f382",
  "changed": [
    "README.md"
  ],
  "requiredReview": [
    ".github/workflows/pages.yml",
    "AGENTS.md",
    "CLAUDE.md",
    "FEATURES.md",
    "PROCEDURE.md",
    "README.md",
    "format-contracts/deliverables.md",
    "scripts/build_carriers.mjs",
    "scripts/capture_rights_evidence.mjs",
    "scripts/check_assurance.mjs",
    "scripts/check_oer.mjs",
    "scripts/data/license-texts.json",
    "scripts/generate_attribution.mjs",
    "scripts/lib/assurance.mjs",
    "scripts/lib/contract.mjs",
    "scripts/lib/rights_preflight.mjs",
    "scripts/pack.mjs",
    "scripts/prepare_source_corpus.mjs",
    "site/assets/orz.svg",
    "site/index.html",
    "site/styles.css",
    "skills/oer-qa/SKILL.md",
    "system/CLAIMS.json",
    "system/QUALITY_PROFILES.json",
    "templates/foundation.personal.example.json",
    "templates/foundation.public-oer.example.json",
    "templates/foundation.restricted.example.json",
    "templates/media-plan.example.json",
    "templates/provenance.example.json",
    "templates/source-corpus.example.json",
    "tests/assurance.test.mjs",
    "tests/carriers.test.mjs",
    "tests/evidence-tools.test.mjs",
    "tests/qa.test.mjs",
    "tests/site.test.mjs"
  ],
  "reviewed": [
    ".github/workflows/pages.yml",
    "AGENTS.md",
    "CLAUDE.md",
    "FEATURES.md",
    "PROCEDURE.md",
    "README.md",
    "format-contracts/deliverables.md",
    "scripts/build_carriers.mjs",
    "scripts/capture_rights_evidence.mjs",
    "scripts/check_assurance.mjs",
    "scripts/check_oer.mjs",
    "scripts/data/license-texts.json",
    "scripts/generate_attribution.mjs",
    "scripts/lib/assurance.mjs",
    "scripts/lib/contract.mjs",
    "scripts/lib/rights_preflight.mjs",
    "scripts/pack.mjs",
    "scripts/prepare_source_corpus.mjs",
    "site/assets/orz.svg",
    "site/index.html",
    "site/styles.css",
    "skills/oer-qa/SKILL.md",
    "system/CLAIMS.json",
    "system/QUALITY_PROFILES.json",
    "templates/foundation.personal.example.json",
    "templates/foundation.public-oer.example.json",
    "templates/foundation.restricted.example.json",
    "templates/media-plan.example.json",
    "templates/provenance.example.json",
    "templates/source-corpus.example.json",
    "tests/assurance.test.mjs",
    "tests/carriers.test.mjs",
    "tests/evidence-tools.test.mjs",
    "tests/qa.test.mjs",
    "tests/site.test.mjs"
  ],
  "impactedClaims": [
    "claim.accessibility.floor",
    "claim.authorship.accountable",
    "claim.carriers.honest-portability",
    "claim.carriers.three-shapes",
    "claim.coherence.revisions",
    "claim.format.contracts",
    "claim.git.visible-edits",
    "claim.language.editorial",
    "claim.media.decision",
    "claim.provenance.complete",
    "claim.release.fail-closed",
    "claim.rights.verified",
    "claim.source.comparison",
    "claim.website.published"
  ],
  "testResults": [
    {
      "path": "tests/assurance.test.mjs",
      "status": "passed"
    },
    {
      "path": "tests/carriers.test.mjs",
      "status": "passed"
    },
    {
      "path": "tests/evidence-tools.test.mjs",
      "status": "passed"
    },
    {
      "path": "tests/qa.test.mjs",
      "status": "passed"
    },
    {
      "path": "tests/site.test.mjs",
      "status": "passed"
    }
  ],
  "attestation": "Reviewed the README website-link update against the deployment workflow, published site, public product claims, assurance kernel, authoring contracts, templates, and required tests. The documentation now points to the canonical custom domain coursewerk.orz.how; no runtime, assurance, packaging, carrier, accessibility, licensing, attribution, or course-authoring behavior changed, and the full test suite passes.",
  "generatedIndexHash": "01d16d678daaf7b1efd51188b02c8efb69d9d7ab0dd79f2653b3b4b3948717a3",
  "acceptedAt": "2026-07-13T05:12:15.584Z"
}
