{
  "schemaVersion": 1,
  "planId": "01266e6f0ceb36abc1136c1ba44f6c25a2a22bca5ed6a4d211f9b23fb506e9c8",
  "baseRef": "main",
  "baseTip": "4238dad8b48acf4a3d062e93ce872e26519a28a6",
  "baseCommit": "4238dad8b48acf4a3d062e93ce872e26519a28a6",
  "reviewedHead": "4238dad8b48acf4a3d062e93ce872e26519a28a6",
  "changed": [
    "AGENTS.md",
    "CHANGELOG.md",
    "CLAUDE.md",
    "FEATURES.md",
    "PROCEDURE.md",
    "README.md",
    "VERSION",
    "docs/assurance-kernel.md",
    "docs/authoring-guidelines.md",
    "docs/coherence-index.md",
    "docs/lite-path.md",
    "docs/wikipedia-science-topic.md",
    "format-contracts/deliverables.md",
    "package.json",
    "scripts/attest_visual_review.mjs",
    "scripts/bind_key_fact_review.mjs",
    "scripts/build_carriers.mjs",
    "scripts/capture_media_evidence.mjs",
    "scripts/capture_rights_evidence.mjs",
    "scripts/check_assurance.mjs",
    "scripts/check_oer.mjs",
    "scripts/generate_source_record.mjs",
    "scripts/lib/assurance.mjs",
    "scripts/lib/coherence.mjs",
    "scripts/lib/key_fact_review.mjs",
    "scripts/lib/source_record.mjs",
    "scripts/lib/visual_review.mjs",
    "scripts/pack.mjs",
    "scripts/prepare_source_corpus.mjs",
    "scripts/prepare_wikipedia_topic.mjs",
    "site/index.html",
    "skills/oer-qa/SKILL.md",
    "system/CLAIMS.json",
    "system/KNOWN_FINDINGS.json",
    "system/QUALITY_PROFILES.json",
    "system/RELATIONSHIPS.json",
    "templates/foundation.public-oer.example.json",
    "templates/foundation.wikipedia-science.example.json",
    "templates/key-fact-review.example.json",
    "templates/provenance.example.json",
    "templates/source-corpus.example.json",
    "templates/source-record.example.json",
    "templates/visual-review.example.json",
    "tests/assurance.test.mjs",
    "tests/carriers.test.mjs",
    "tests/evidence-tools.test.mjs",
    "tests/qa.test.mjs",
    "tests/reviews.test.mjs",
    "tests/site.test.mjs"
  ],
  "requiredReview": [
    ".github/workflows/pages.yml",
    "AGENTS.md",
    "CHANGELOG.md",
    "CLAUDE.md",
    "FEATURES.md",
    "PROCEDURE.md",
    "README.md",
    "VERSION",
    "docs/assurance-kernel.md",
    "docs/authoring-guidelines.md",
    "docs/coherence-index.md",
    "docs/lite-path.md",
    "docs/wikipedia-science-topic.md",
    "format-contracts/deliverables.md",
    "package.json",
    "scripts/attest_visual_review.mjs",
    "scripts/bind_key_fact_review.mjs",
    "scripts/build_carriers.mjs",
    "scripts/capture_media_evidence.mjs",
    "scripts/capture_rights_evidence.mjs",
    "scripts/check_assurance.mjs",
    "scripts/check_oer.mjs",
    "scripts/data/license-texts.json",
    "scripts/generate_attribution.mjs",
    "scripts/generate_source_record.mjs",
    "scripts/index_components.mjs",
    "scripts/lib/assurance.mjs",
    "scripts/lib/coherence.mjs",
    "scripts/lib/contract.mjs",
    "scripts/lib/key_fact_review.mjs",
    "scripts/lib/rights_preflight.mjs",
    "scripts/lib/source_record.mjs",
    "scripts/lib/visual_review.mjs",
    "scripts/pack.mjs",
    "scripts/prepare_source_corpus.mjs",
    "scripts/prepare_wikipedia_topic.mjs",
    "scripts/revision_impact.mjs",
    "site/assets/orz.svg",
    "site/index.html",
    "site/styles.css",
    "skills/oer-qa/SKILL.md",
    "system/CLAIMS.json",
    "system/KNOWN_FINDINGS.json",
    "system/QUALITY_PROFILES.json",
    "system/RELATIONSHIPS.json",
    "templates/foundation.personal.example.json",
    "templates/foundation.public-oer.example.json",
    "templates/foundation.restricted.example.json",
    "templates/foundation.wikipedia-science.example.json",
    "templates/key-fact-review.example.json",
    "templates/media-plan.example.json",
    "templates/provenance.example.json",
    "templates/source-corpus.example.json",
    "templates/source-record.example.json",
    "templates/visual-review.example.json",
    "tests/assurance.test.mjs",
    "tests/carriers.test.mjs",
    "tests/evidence-tools.test.mjs",
    "tests/qa.test.mjs",
    "tests/reviews.test.mjs",
    "tests/site.test.mjs"
  ],
  "reviewed": [
    ".github/workflows/pages.yml",
    "AGENTS.md",
    "CHANGELOG.md",
    "CLAUDE.md",
    "FEATURES.md",
    "PROCEDURE.md",
    "README.md",
    "VERSION",
    "docs/assurance-kernel.md",
    "docs/authoring-guidelines.md",
    "docs/coherence-index.md",
    "docs/lite-path.md",
    "docs/wikipedia-science-topic.md",
    "format-contracts/deliverables.md",
    "package.json",
    "scripts/attest_visual_review.mjs",
    "scripts/bind_key_fact_review.mjs",
    "scripts/build_carriers.mjs",
    "scripts/capture_media_evidence.mjs",
    "scripts/capture_rights_evidence.mjs",
    "scripts/check_assurance.mjs",
    "scripts/check_oer.mjs",
    "scripts/data/license-texts.json",
    "scripts/generate_attribution.mjs",
    "scripts/generate_source_record.mjs",
    "scripts/index_components.mjs",
    "scripts/lib/assurance.mjs",
    "scripts/lib/coherence.mjs",
    "scripts/lib/contract.mjs",
    "scripts/lib/key_fact_review.mjs",
    "scripts/lib/rights_preflight.mjs",
    "scripts/lib/source_record.mjs",
    "scripts/lib/visual_review.mjs",
    "scripts/pack.mjs",
    "scripts/prepare_source_corpus.mjs",
    "scripts/prepare_wikipedia_topic.mjs",
    "scripts/revision_impact.mjs",
    "site/assets/orz.svg",
    "site/index.html",
    "site/styles.css",
    "skills/oer-qa/SKILL.md",
    "system/CLAIMS.json",
    "system/KNOWN_FINDINGS.json",
    "system/QUALITY_PROFILES.json",
    "system/RELATIONSHIPS.json",
    "templates/foundation.personal.example.json",
    "templates/foundation.public-oer.example.json",
    "templates/foundation.restricted.example.json",
    "templates/foundation.wikipedia-science.example.json",
    "templates/key-fact-review.example.json",
    "templates/media-plan.example.json",
    "templates/provenance.example.json",
    "templates/source-corpus.example.json",
    "templates/source-record.example.json",
    "templates/visual-review.example.json",
    "tests/assurance.test.mjs",
    "tests/carriers.test.mjs",
    "tests/evidence-tools.test.mjs",
    "tests/qa.test.mjs",
    "tests/reviews.test.mjs",
    "tests/site.test.mjs"
  ],
  "impactedClaims": [
    "claim.accessibility.floor",
    "claim.authorship.accountable",
    "claim.carriers.honest-portability",
    "claim.carriers.three-shapes",
    "claim.coherence.revisions",
    "claim.format.contracts",
    "claim.git.visible-edits",
    "claim.language.editorial",
    "claim.media.decision",
    "claim.provenance.complete",
    "claim.release.fail-closed",
    "claim.review.key-facts",
    "claim.rights.verified",
    "claim.source.comparison",
    "claim.website.published"
  ],
  "testResults": [
    {
      "path": "tests/assurance.test.mjs",
      "status": "passed"
    },
    {
      "path": "tests/carriers.test.mjs",
      "status": "passed"
    },
    {
      "path": "tests/evidence-tools.test.mjs",
      "status": "passed"
    },
    {
      "path": "tests/qa.test.mjs",
      "status": "passed"
    },
    {
      "path": "tests/reviews.test.mjs",
      "status": "passed"
    },
    {
      "path": "tests/site.test.mjs",
      "status": "passed"
    },
    {
      "path": "tests/system-index.test.mjs",
      "status": "passed"
    }
  ],
  "attestation": "Reviewed the complete merge-base impact set across the assurance kernel, Light/Full critique rules, source and media evidence, accountable identity, Wikipedia deduplication, carrier fingerprints and human review, package coherence, release receipts, templates, public claims, website, and release metadata. Verified that unchanged correlated contracts, license data, deployment, styles, personal/restricted templates, attribution generation, rights preflight, and revision tooling remain compatible. The full 71-test suite passed, including two-build carrier/pack integration, adversarial license/media/source tests, focused review freshness and chapter coverage, website claims, and branch-aware system-index tests.",
  "generatedIndexHash": "8bb927c2701926c9c8d2f76442de1d34f564f3f6c27c9fccd7a8fc5b421dff7a",
  "acceptedAt": "2026-07-14T06:55:24.336Z"
}
