{
  "schemaVersion": 1,
  "planId": "b8a67efb4de3965107a2aa299369d21fa84d860c5cb8510ba79449313db6f20f",
  "baseRef": "HEAD",
  "baseTip": "5634c172a3bf20c56314e2be444e1ba2032426e8",
  "baseCommit": "5634c172a3bf20c56314e2be444e1ba2032426e8",
  "reviewedHead": "5634c172a3bf20c56314e2be444e1ba2032426e8",
  "changed": [
    "site/assets/coursewerk-favicon.svg",
    "site/index.html",
    "tests/site.test.mjs"
  ],
  "requiredReview": [
    ".github/workflows/pages.yml",
    "AGENTS.md",
    "CLAUDE.md",
    "FEATURES.md",
    "PROCEDURE.md",
    "README.md",
    "format-contracts/deliverables.md",
    "scripts/build_carriers.mjs",
    "scripts/capture_rights_evidence.mjs",
    "scripts/check_assurance.mjs",
    "scripts/check_oer.mjs",
    "scripts/data/license-texts.json",
    "scripts/generate_attribution.mjs",
    "scripts/lib/assurance.mjs",
    "scripts/lib/contract.mjs",
    "scripts/lib/rights_preflight.mjs",
    "scripts/pack.mjs",
    "scripts/prepare_source_corpus.mjs",
    "site/assets/coursewerk-favicon.svg",
    "site/assets/orz.svg",
    "site/index.html",
    "site/styles.css",
    "skills/oer-qa/SKILL.md",
    "system/CLAIMS.json",
    "system/QUALITY_PROFILES.json",
    "templates/foundation.personal.example.json",
    "templates/foundation.public-oer.example.json",
    "templates/foundation.restricted.example.json",
    "templates/media-plan.example.json",
    "templates/provenance.example.json",
    "templates/source-corpus.example.json",
    "tests/assurance.test.mjs",
    "tests/carriers.test.mjs",
    "tests/evidence-tools.test.mjs",
    "tests/qa.test.mjs",
    "tests/site.test.mjs"
  ],
  "reviewed": [
    ".github/workflows/pages.yml",
    "AGENTS.md",
    "CLAUDE.md",
    "FEATURES.md",
    "PROCEDURE.md",
    "README.md",
    "format-contracts/deliverables.md",
    "scripts/build_carriers.mjs",
    "scripts/capture_rights_evidence.mjs",
    "scripts/check_assurance.mjs",
    "scripts/check_oer.mjs",
    "scripts/data/license-texts.json",
    "scripts/generate_attribution.mjs",
    "scripts/lib/assurance.mjs",
    "scripts/lib/contract.mjs",
    "scripts/lib/rights_preflight.mjs",
    "scripts/pack.mjs",
    "scripts/prepare_source_corpus.mjs",
    "site/assets/coursewerk-favicon.svg",
    "site/assets/orz.svg",
    "site/index.html",
    "site/styles.css",
    "skills/oer-qa/SKILL.md",
    "system/CLAIMS.json",
    "system/QUALITY_PROFILES.json",
    "templates/foundation.personal.example.json",
    "templates/foundation.public-oer.example.json",
    "templates/foundation.restricted.example.json",
    "templates/media-plan.example.json",
    "templates/provenance.example.json",
    "templates/source-corpus.example.json",
    "tests/assurance.test.mjs",
    "tests/carriers.test.mjs",
    "tests/evidence-tools.test.mjs",
    "tests/qa.test.mjs",
    "tests/site.test.mjs"
  ],
  "impactedClaims": [
    "claim.accessibility.floor",
    "claim.authorship.accountable",
    "claim.carriers.honest-portability",
    "claim.carriers.three-shapes",
    "claim.coherence.revisions",
    "claim.format.contracts",
    "claim.git.visible-edits",
    "claim.language.editorial",
    "claim.media.decision",
    "claim.provenance.complete",
    "claim.release.fail-closed",
    "claim.rights.verified",
    "claim.source.comparison",
    "claim.website.published"
  ],
  "testResults": [
    {
      "path": "tests/assurance.test.mjs",
      "status": "passed"
    },
    {
      "path": "tests/carriers.test.mjs",
      "status": "passed"
    },
    {
      "path": "tests/evidence-tools.test.mjs",
      "status": "passed"
    },
    {
      "path": "tests/qa.test.mjs",
      "status": "passed"
    },
    {
      "path": "tests/site.test.mjs",
      "status": "passed"
    }
  ],
  "attestation": "Reviewed the favicon-only website change against every dependency and product claim selected by the Coursewerk system index. The new standalone Coursewerk icon is distinct from the orz family mark, while the header and footer retain the orz logo; browser inspection confirmed the rendered SVG and favicon reference. No assurance, rights, carrier, packaging, accessibility, or authoring-contract behavior changed, and the directly affected site tests pass.",
  "generatedIndexHash": "474d92f8128d81c76af56521c3820d08a9e6a07b62ddf9cad67557828893b35e",
  "acceptedAt": "2026-07-13T05:08:07.946Z"
}
