{
  "schemaVersion": 1,
  "planId": "8a3095ed98d9c3cce1ca196ca5739abb16d0ea775021007b4deadf37f4375eb7",
  "baseRef": "HEAD",
  "baseTip": "c8e868ebc8a8d712b2b98c7fef3fab06a466a530",
  "baseCommit": "c8e868ebc8a8d712b2b98c7fef3fab06a466a530",
  "reviewedHead": "c8e868ebc8a8d712b2b98c7fef3fab06a466a530",
  "changed": [
    ".github/workflows/pages.yml",
    ".github/workflows/system-integrity.yml",
    "tests/site.test.mjs"
  ],
  "requiredReview": [
    ".github/workflows/pages.yml",
    ".github/workflows/system-integrity.yml",
    "AGENTS.md",
    "CLAUDE.md",
    "FEATURES.md",
    "PROCEDURE.md",
    "README.md",
    "docs/coursewerk-system-index.md",
    "format-contracts/deliverables.md",
    "scripts/build_carriers.mjs",
    "scripts/capture_rights_evidence.mjs",
    "scripts/check_assurance.mjs",
    "scripts/check_oer.mjs",
    "scripts/data/license-texts.json",
    "scripts/generate_attribution.mjs",
    "scripts/lib/assurance.mjs",
    "scripts/lib/contract.mjs",
    "scripts/lib/rights_preflight.mjs",
    "scripts/lib/system_index.mjs",
    "scripts/pack.mjs",
    "scripts/prepare_source_corpus.mjs",
    "site/assets/orz.svg",
    "site/index.html",
    "site/styles.css",
    "skills/oer-qa/SKILL.md",
    "system/CLAIMS.json",
    "system/COMPONENTS.json",
    "system/QUALITY_PROFILES.json",
    "templates/foundation.personal.example.json",
    "templates/foundation.public-oer.example.json",
    "templates/foundation.restricted.example.json",
    "templates/media-plan.example.json",
    "templates/provenance.example.json",
    "templates/source-corpus.example.json",
    "tests/assurance.test.mjs",
    "tests/carriers.test.mjs",
    "tests/evidence-tools.test.mjs",
    "tests/qa.test.mjs",
    "tests/site.test.mjs",
    "tests/system-index.test.mjs"
  ],
  "reviewed": [
    ".github/workflows/pages.yml",
    ".github/workflows/system-integrity.yml",
    "AGENTS.md",
    "CLAUDE.md",
    "FEATURES.md",
    "PROCEDURE.md",
    "README.md",
    "docs/coursewerk-system-index.md",
    "format-contracts/deliverables.md",
    "scripts/build_carriers.mjs",
    "scripts/capture_rights_evidence.mjs",
    "scripts/check_assurance.mjs",
    "scripts/check_oer.mjs",
    "scripts/data/license-texts.json",
    "scripts/generate_attribution.mjs",
    "scripts/lib/assurance.mjs",
    "scripts/lib/contract.mjs",
    "scripts/lib/rights_preflight.mjs",
    "scripts/lib/system_index.mjs",
    "scripts/pack.mjs",
    "scripts/prepare_source_corpus.mjs",
    "site/assets/orz.svg",
    "site/index.html",
    "site/styles.css",
    "skills/oer-qa/SKILL.md",
    "system/CLAIMS.json",
    "system/COMPONENTS.json",
    "system/QUALITY_PROFILES.json",
    "templates/foundation.personal.example.json",
    "templates/foundation.public-oer.example.json",
    "templates/foundation.restricted.example.json",
    "templates/media-plan.example.json",
    "templates/provenance.example.json",
    "templates/source-corpus.example.json",
    "tests/assurance.test.mjs",
    "tests/carriers.test.mjs",
    "tests/evidence-tools.test.mjs",
    "tests/qa.test.mjs",
    "tests/site.test.mjs",
    "tests/system-index.test.mjs"
  ],
  "impactedClaims": [
    "claim.accessibility.floor",
    "claim.authorship.accountable",
    "claim.carriers.honest-portability",
    "claim.carriers.three-shapes",
    "claim.coherence.revisions",
    "claim.format.contracts",
    "claim.git.visible-edits",
    "claim.language.editorial",
    "claim.media.decision",
    "claim.provenance.complete",
    "claim.release.fail-closed",
    "claim.rights.verified",
    "claim.source.comparison",
    "claim.system.branch-coherence",
    "claim.website.published"
  ],
  "testResults": [
    {
      "path": "tests/assurance.test.mjs",
      "status": "passed"
    },
    {
      "path": "tests/carriers.test.mjs",
      "status": "passed"
    },
    {
      "path": "tests/evidence-tools.test.mjs",
      "status": "passed"
    },
    {
      "path": "tests/qa.test.mjs",
      "status": "passed"
    },
    {
      "path": "tests/site.test.mjs",
      "status": "passed"
    },
    {
      "path": "tests/system-index.test.mjs",
      "status": "passed"
    }
  ],
  "attestation": "Reviewed the Pages enablement correction, lockfile-independent CI setup, website deployment contract, all propagated product claims and assurance components, and the updated website regression; the full suite passed immediately before this workflow-only correction and the changed site test passed afterward.",
  "generatedIndexHash": "27cd4a852de502f8af9c512d2248566fd7893845505b54f932caa5feb6b6264f",
  "acceptedAt": "2026-07-13T04:12:06.565Z"
}
