{
  "schemaVersion": 1,
  "planId": "868f19ba86efed7b1aae1dfa9d0e9d8df09076c24098e1f1919e6ae19d2f8a1b",
  "baseRef": "HEAD",
  "baseTip": "acce4d394bfb92aa80bb84b3addee0002329a8a3",
  "baseCommit": "acce4d394bfb92aa80bb84b3addee0002329a8a3",
  "reviewedHead": "acce4d394bfb92aa80bb84b3addee0002329a8a3",
  "changed": [
    "CHANGELOG.md",
    "CLAUDE.md",
    "FEATURES.md",
    "PROCEDURE.md",
    "README.md",
    "VERSION",
    "docs/assurance-kernel.md",
    "docs/authoring-guidelines.md",
    "docs/lite-path.md",
    "docs/wikipedia-science-topic.md",
    "format-contracts/deliverables.md",
    "package.json",
    "scripts/capture_rights_evidence.mjs",
    "scripts/check_assurance.mjs",
    "scripts/check_oer.mjs",
    "scripts/data/source-policies.json",
    "scripts/lib/assurance.mjs",
    "scripts/lib/pre_ingestion.mjs",
    "scripts/lib/rights_preflight.mjs",
    "scripts/pack.mjs",
    "site/index.html",
    "skills/oer-figures/SKILL.md",
    "system/CLAIMS.json",
    "system/KNOWN_FINDINGS.json",
    "system/RELATIONSHIPS.json",
    "templates/foundation.personal.example.json",
    "templates/foundation.restricted.example.json",
    "tests/assurance.test.mjs",
    "tests/evidence-tools.test.mjs",
    "tests/qa.test.mjs",
    "tests/site.test.mjs"
  ],
  "requiredReview": [
    ".github/workflows/pages.yml",
    "AGENTS.md",
    "CHANGELOG.md",
    "CLAUDE.md",
    "FEATURES.md",
    "PROCEDURE.md",
    "README.md",
    "VERSION",
    "docs/assurance-kernel.md",
    "docs/authoring-guidelines.md",
    "docs/lite-path.md",
    "docs/wikipedia-science-topic.md",
    "format-contracts/deliverables.md",
    "package.json",
    "scripts/build_carriers.mjs",
    "scripts/capture_rights_evidence.mjs",
    "scripts/check_assurance.mjs",
    "scripts/check_oer.mjs",
    "scripts/data/license-texts.json",
    "scripts/data/source-policies.json",
    "scripts/generate_attribution.mjs",
    "scripts/lib/assurance.mjs",
    "scripts/lib/contract.mjs",
    "scripts/lib/pre_ingestion.mjs",
    "scripts/lib/rights_preflight.mjs",
    "scripts/pack.mjs",
    "scripts/prepare_source_corpus.mjs",
    "site/assets/orz.svg",
    "site/index.html",
    "site/styles.css",
    "skills/oer-figures/SKILL.md",
    "skills/oer-qa/SKILL.md",
    "system/CLAIMS.json",
    "system/KNOWN_FINDINGS.json",
    "system/QUALITY_PROFILES.json",
    "system/RELATIONSHIPS.json",
    "templates/foundation.personal.example.json",
    "templates/foundation.public-oer.example.json",
    "templates/foundation.restricted.example.json",
    "templates/media-plan.example.json",
    "templates/provenance.example.json",
    "templates/source-corpus.example.json",
    "tests/assurance.test.mjs",
    "tests/carriers.test.mjs",
    "tests/evidence-tools.test.mjs",
    "tests/qa.test.mjs",
    "tests/site.test.mjs"
  ],
  "reviewed": [
    ".github/workflows/pages.yml",
    "AGENTS.md",
    "CHANGELOG.md",
    "CLAUDE.md",
    "FEATURES.md",
    "PROCEDURE.md",
    "README.md",
    "VERSION",
    "docs/assurance-kernel.md",
    "docs/authoring-guidelines.md",
    "docs/lite-path.md",
    "docs/wikipedia-science-topic.md",
    "format-contracts/deliverables.md",
    "package.json",
    "scripts/build_carriers.mjs",
    "scripts/capture_rights_evidence.mjs",
    "scripts/check_assurance.mjs",
    "scripts/check_oer.mjs",
    "scripts/data/license-texts.json",
    "scripts/data/source-policies.json",
    "scripts/generate_attribution.mjs",
    "scripts/lib/assurance.mjs",
    "scripts/lib/contract.mjs",
    "scripts/lib/pre_ingestion.mjs",
    "scripts/lib/rights_preflight.mjs",
    "scripts/pack.mjs",
    "scripts/prepare_source_corpus.mjs",
    "site/assets/orz.svg",
    "site/index.html",
    "site/styles.css",
    "skills/oer-figures/SKILL.md",
    "skills/oer-qa/SKILL.md",
    "system/CLAIMS.json",
    "system/KNOWN_FINDINGS.json",
    "system/QUALITY_PROFILES.json",
    "system/RELATIONSHIPS.json",
    "templates/foundation.personal.example.json",
    "templates/foundation.public-oer.example.json",
    "templates/foundation.restricted.example.json",
    "templates/media-plan.example.json",
    "templates/provenance.example.json",
    "templates/source-corpus.example.json",
    "tests/assurance.test.mjs",
    "tests/carriers.test.mjs",
    "tests/evidence-tools.test.mjs",
    "tests/qa.test.mjs",
    "tests/site.test.mjs"
  ],
  "impactedClaims": [
    "claim.accessibility.floor",
    "claim.authorship.accountable",
    "claim.carriers.honest-portability",
    "claim.carriers.three-shapes",
    "claim.coherence.revisions",
    "claim.format.contracts",
    "claim.git.visible-edits",
    "claim.language.editorial",
    "claim.media.decision",
    "claim.provenance.complete",
    "claim.release.fail-closed",
    "claim.rights.verified",
    "claim.source.comparison",
    "claim.website.published"
  ],
  "testResults": [
    {
      "path": "tests/assurance.test.mjs",
      "status": "passed"
    },
    {
      "path": "tests/carriers.test.mjs",
      "status": "passed"
    },
    {
      "path": "tests/evidence-tools.test.mjs",
      "status": "passed"
    },
    {
      "path": "tests/qa.test.mjs",
      "status": "passed"
    },
    {
      "path": "tests/site.test.mjs",
      "status": "passed"
    }
  ],
  "attestation": "Reviewed the complete dependency impact for separating protected expression and verified license facts from nonbinding Coursewerk legal conclusions; confirmed that personal-private and restricted non-published authoring accept sources without rights receipts, public workflows preserve AI/access notices as nonblocking instructor warnings, OpenStax is an avoid-when-practical preference rather than a prohibition, and copied/adapted public expression still receives honest license and attribution checks. The complete 60-test suite, syntax checks, whitespace checks, release-warning persistence, documentation, templates, website, and self-index all pass.",
  "generatedIndexHash": "db2f37bf84a5952f5452ffc4766b2e2c794b5b8aed4c7f0e8a5c26296ff18973",
  "acceptedAt": "2026-07-13T07:02:42.227Z"
}
